{
    "name": "Settings menu",
    "access": {
        "groups": ["setting.default.user"]
    },
    "search": true,
    "layout": {
        "items": [
            {

                "id": "base",
                "label": "Base",
                "description": "",
                "icon": "now_widgets",
                "type": "parent",
                "route": "/settings/core",
                "children": [
                    {
                        "id": "security",
                        "label": "Security",
                        "description": "",
                        "icon": "lock_open",
                        "type": "parent",
                        "children": [
                            {
                                "id": "permissions",
                                "type": "entry",
                                "label": "Permissions",
                                "icon": "how_to_reg",
                                "description": "",
                                "context": {
                                    "entity": "core\\Permission",
                                    "view": "list.default"
                                }
                            },
                            {
                                "id": "users",
                                "type": "entry",
                                "label": "Users",
                                "icon": "person",
                                "description": "",
                                "context": {
                                    "entity": "core\\User",
                                    "view": "list.default"
                                }
                            },
                            {
                                "id": "groups",
                                "type": "entry",
                                "label": "Groups",
                                "icon": "group",
                                "description": "",
                                "context": {
                                    "entity": "core\\Group",
                                    "view": "list.default"
                                }
                            },
                            {
                                "id": "policies",
                                "type": "entry",
                                "label": "Security Policies",
                                "icon": "badge",
                                "description": "",
                                "context": {
                                    "entity": "core\\security\\SecurityPolicy",
                                    "view": "list.default"
                                }
                            }
                        ]
                    }
                ]
            },
            {
                "id": "communication",
                "label": "Communication",
                "description": "",
                "icon": "mode_comment",
                "type": "parent",
                "children": [
                    {
                        "id": "communication.alerts",
                        "label": "Alerts",
                        "description": "",
                        "icon": "chrome_reader_mode",
                        "type": "parent",
                        "children": [
                            {
                                "id": "communication.alert.messages",
                                "type": "entry",
                                "label": "All messages",
                                "description": "",
                                "context": {
                                    "entity": "core\\alert\\Message",
                                    "view": "list.default"
                                }
                            },
                            {
                                "id": "communication.alert.message_models",
                                "type": "entry",
                                "label": "Message models",
                                "description": "",
                                "context": {
                                    "entity": "core\\alert\\MessageModel",
                                    "view": "list.default"
                                }
                            }
                        ]
                    },
                    {
                        "id": "communication.emails",
                        "label": "Emails",
                        "description": "",
                        "icon": "alternate_email",
                        "type": "parent",
                        "children": [
                            {
                                "id": "communication.emails.all",
                                "type": "entry",
                                "label": "All emails",
                                "description": "",
                                "context": {
                                    "entity": "core\\Mail",
                                    "view": "list.default"
                                }
                            }
                        ]
                    }
                ]
            },
            {
                "id": "settings",
                "label": "Configuration",
                "description": "",
                "icon": "settings",
                "type": "parent",
                "children": [
                    {
                        "id": "settings.scheduler",
                        "label": "Scheduler",
                        "description": "",
                        "icon": "schedule",
                        "type": "parent",
                        "children": [
                            {
                                "id": "settings.cron.tasks",
                                "type": "entry",
                                "label": "Scheduled tasks",
                                "description": "",
                                "context": {
                                    "entity": "core\\Task",
                                    "view": "list.default"
                                }
                            },
                            {
                                "id": "settings.cron.tasks.recurring",
                                "type": "entry",
                                "label": "Recurring tasks",
                                "description": "",
                                "context": {
                                    "entity": "core\\Task",
                                    "view": "list.default",
                                    "domain": ["is_recurring", "=", true]
                                }
                            }
                        ]
                    },
                    {
                        "id": "settings.import",
                        "label": "Import",
                        "description": "",
                        "icon": "settings_applications",
                        "type": "parent",
                        "children": [
                            {
                                "id": "settings.import.entity-mappings",
                                "label": "Entity mappings",
                                "description": "",
                                "icon": "device_hub",
                                "type": "entry",
                                "context": {
                                    "entity": "core\\import\\EntityMapping",
                                    "view": "list.default"
                                }
                            }
                        ]
                    },
                    {
                        "id": "settings.settings",
                        "label": "Settings",
                        "description": "",
                        "icon": "settings",
                        "type": "parent",
                        "children": [
                            {
                                "id": "settings.settings.settings",
                                "type": "entry",
                                "label": "Available Settings",
                                "description": "",
                                "context": {
                                    "entity": "core\\setting\\Setting",
                                    "view": "list.default"
                                }
                            },
                            {
                                "id": "settings.settings.settings_values",
                                "type": "entry",
                                "label": "Settings values",
                                "description": "",
                                "context": {
                                    "entity": "core\\setting\\SettingValue",
                                    "view": "list.default"
                                }
                            },
                            {
                                "id": "settings.settings.settings_sequences",
                                "type": "entry",
                                "label": "Settings sequences",
                                "description": "",
                                "context": {
                                    "entity": "core\\setting\\SettingSequence",
                                    "view": "list.default"
                                }
                            }
                        ]
                    }
                ]
            }
        ]
    }
}
